[
  {"category":"win-in-1","id":"win-in-1-001","moves":[2,2,6,5,4,5,4,0,0,2,1,4,0,6,4,2,5,1,2,2,5,6,5,5],"solutions":[3]},
  {"category":"win-in-1","id":"win-in-1-002","moves":[3,6,0,0,0,2,0,4,5,3,1,2,2,5,3,0,0,6,1,6],"solutions":[1,3]},
  {"category":"win-in-1","id":"win-in-1-003","moves":[4,0,4,4,5,1,6,6],"solutions":[3]},
  {"category":"win-in-1","id":"win-in-1-004","moves":[6,2,3,2,6,5,5,4,2,6,6,4,0,0,5,4,1,6,2,0,3,5,1,1,3,1,4,3,4,5],"solutions":[3]},
  {"category":"win-in-1","id":"win-in-1-005","moves":[4,1,2,2,1,5,3,4,3,0,4,1,0,1,1,5,3,4],"solutions":[3]},
  {"category":"win-in-1","id":"win-in-1-006","moves":[5,0,5,5,2,5,0,6,3,6],"solutions":[4]},
  {"category":"win-in-1","id":"win-in-1-007","moves":[6,2,6,4,6,0,1,1,4,3,2,1,0,6,6,0,6],"solutions":[5]},
  {"category":"win-in-1","id":"win-in-1-008","moves":[0,3,4,1,1,6,6,1,0,3,6,0,3,2,4,4,6,6,0,4,2,4,5,2,6,1],"solutions":[2]},
  {"category":"win-in-1","id":"win-in-1-009","moves":[1,2,6,5,0,3,6],"solutions":[4]},
  {"category":"win-in-1","id":"win-in-1-010","moves":[1,3,0,3,0,2,6,2,1,5,6,5,3,6,0,3,2,6],"solutions":[0,1]},
  {"category":"win-in-1","id":"win-in-1-011","moves":[5,4,2,4,3,2,3,0,3,4,5,6,5,5,1,6,4,6],"solutions":[3]},
  {"category":"win-in-1","id":"win-in-1-012","moves":[4,4,2,2,0,2,5,1,4,2,2,1,1,3,1,1,6],"solutions":[3]},
  {"category":"win-in-1","id":"win-in-1-013","moves":[1,3,5,0,1,2,3,4,1,0,0,2,2,1,2,0],"solutions":[3]},
  {"category":"win-in-1","id":"win-in-1-014","moves":[2,4,1,4,5,4,4,0,2,5,6,4,5,1,6,0,3,6,4,3,1,1,6],"solutions":[2]},
  {"category":"win-in-1","id":"win-in-1-015","moves":[0,3,0,0,5,4,5,4,4,3,4,5,3,3,1,0,0,3,6,3,6,1,4,5,1,6],"solutions":[4]},
  {"category":"win-in-1","id":"win-in-1-016","moves":[1,3,1,5,5,6,6,0,5,0,1,0],"solutions":[1]},
  {"category":"win-in-1","id":"win-in-1-017","moves":[3,2,3,4,0,6,1,0,4,6,0,6,1,5,0,4,1],"solutions":[6]},
  {"category":"win-in-1","id":"win-in-1-018","moves":[4,2,4,1,1,5,0,0,0,0,3,3,4,2,6,4,0,2,5,6,2,4,3,0],"solutions":[3]},
  {"category":"win-in-1","id":"win-in-1-019","moves":[1,2,1,3,0,4,2,6,1,1,1,6,0,3,5,1,6,4,4,0,3,3,5,0,0],"solutions":[2]},
  {"category":"win-in-1","id":"win-in-1-020","moves":[4,1,2,4,0,3,4,6,0,4,2,3,2,6,3,3,6,4,0,2,3,0,1,5,2,6,3,0,5,0],"solutions":[1,5]},
  {"category":"win-in-1","id":"win-in-1-021","moves":[4,3,0,1,4,3,4,5,3,2,2,2],"solutions":[4]},
  {"category":"win-in-1","id":"win-in-1-022","moves":[2,0,3,1,3,1,2,3,1,2,6],"solutions":[3]},
  {"category":"win-in-1","id":"win-in-1-023","moves":[3,5,3,0,4,3,4,0,4,1],"solutions":[4]},
  {"category":"win-in-1","id":"win-in-1-024","moves":[1,5,3,3,1,0,4,5,3,4],"solutions":[2]},
  {"category":"win-in-1","id":"win-in-1-025","moves":[1,6,4,4,5,5,2,2,0,5,4,4,0,1],"solutions":[3]},
  {"category":"win-in-1","id":"win-in-1-026","moves":[3,3,6,6,5,6,3,0],"solutions":[4]},
  {"category":"win-in-1","id":"win-in-1-027","moves":[2,5,2,0,3,3,4,0,4,4],"solutions":[1]},
  {"category":"win-in-1","id":"win-in-1-028","moves":[1,1,0,3,3,3,1,3,5,0,1,6,0,2,0,3,4,2],"solutions":[2]},
  {"category":"win-in-1","id":"win-in-1-029","moves":[5,5,6,6,3,5],"solutions":[4]},
  {"category":"win-in-1","id":"win-in-1-030","moves":[1,3,1,1,1,6,0,2,5,2,5,1,5,0,2,0,6,6,1,5,2,4,6,5,3,3,5,2],"solutions":[3,4]},
  {"category":"win-in-1","id":"win-in-1-031","moves":[3,3,3,0,0,1,3,0,0,2,4,4,6,2,0],"solutions":[1]},
  {"category":"win-in-1","id":"win-in-1-032","moves":[0,6,3,2,5,4,6,4,5,4,1,1,2,5,6,3,5,0,6,0,1,3],"solutions":[0,6]},
  {"category":"win-in-1","id":"win-in-1-033","moves":[4,4,0,6,3,4,4,3,0,1,2,5,6,2,3,0,2,4,0],"solutions":[1,5]},
  {"category":"win-in-1","id":"win-in-1-034","moves":[0,2,6,0,5,5,4,5,4,3,3,3,3,4,3,3,5,1,5,0,0,2,0,1,5,0,2,6,4,2],"solutions":[4]},
  {"category":"win-in-1","id":"win-in-1-035","moves":[2,4,6,4,1,1,1,3,1,6,1,0,6,0,4,5],"solutions":[1]},
  {"category":"win-in-1","id":"win-in-1-036","moves":[3,1,1,2,4,6,2,0,2,3,1,6,5,5,6,3,5,6,1,3,0,2,2,5,3,3,2,6],"solutions":[1]},
  {"category":"win-in-1","id":"win-in-1-037","moves":[0,6,1,0,4,3,0,5,5,1,1,3,3,2,5,3,6,6,1,0,5,4,0,3,4,6,0,1,6],"solutions":[2]},
  {"category":"win-in-1","id":"win-in-1-038","moves":[2,3,3,2,5,1,5,3,0,4,5,4,3,3],"solutions":[5]},
  {"category":"block-in-1","id":"block-in-1-001","moves":[0,2,2,3,2,6,6,1],"solutions":[4]},
  {"category":"block-in-1","id":"block-in-1-002","moves":[1,4,3,1,1,4,1,6,4,0,6,4,4,3,6,1,0,0,4,0,6,1,3],"solutions":[6]},
  {"category":"block-in-1","id":"block-in-1-003","moves":[5,2,1,1,4,0,0,2,0,6,5,5,4,0,6,1],"solutions":[3]},
  {"category":"block-in-1","id":"block-in-1-004","moves":[3,1,3,5,5,1,3,6,5,0,1,1,4],"solutions":[3]},
  {"category":"block-in-1","id":"block-in-1-005","moves":[1,1,3,1,3,5,3],"solutions":[3]},
  {"category":"block-in-1","id":"block-in-1-006","moves":[5,4,1,4,1,4,2,0,5,5],"solutions":[4]},
  {"category":"block-in-1","id":"block-in-1-007","moves":[0,0,5,2,0,1,6,0,1,1,2,6,6,6,3],"solutions":[4]},
  {"category":"block-in-1","id":"block-in-1-008","moves":[1,5,5,6,3,5,6,0,2,0,0,0,2],"solutions":[4]},
  {"category":"block-in-1","id":"block-in-1-009","moves":[4,6,3,0,0,3,1,0,4,6,3],"solutions":[2]},
  {"category":"block-in-1","id":"block-in-1-010","moves":[4,4,1,6,2,6,1],"solutions":[3]},
  {"category":"block-in-1","id":"block-in-1-011","moves":[2,3,1,6,4,3,0,2,2,0],"solutions":[1]},
  {"category":"block-in-1","id":"block-in-1-012","moves":[4,2,4,1,0,6,2,4,1,5,3],"solutions":[3]},
  {"category":"block-in-1","id":"block-in-1-013","moves":[5,0,3,5,3,1,2],"solutions":[4]},
  {"category":"block-in-1","id":"block-in-1-014","moves":[4,5,0,5,3,1,4,6,4,3,5],"solutions":[4]},
  {"category":"block-in-1","id":"block-in-1-015","moves":[3,4,4,1,3,5,6,4,2,2,0,2,5,6,5,3],"solutions":[4]},
  {"category":"block-in-1","id":"block-in-1-016","moves":[1,4,1,5,6,5,2,5,5,2,2,5,1,4,5,6,0,1,0],"solutions":[3]},
  {"category":"block-in-1","id":"block-in-1-017","moves":[2,2,2,6,2,0,2,4,0,5,0,1,4,6,3,6,3,0,4,2,1,1,4,4],"solutions":[6]},
  {"category":"block-in-1","id":"block-in-1-018","moves":[5,2,0,0,2,2,0,5,4,3,3,5,3,1,4,1,0,2,4,0,0,2,1,1,2],"solutions":[4]},
  {"category":"block-in-1","id":"block-in-1-019","moves":[1,1,1,5,4,6,5,4,5,0,1,0,6,1,5],"solutions":[5]},
  {"category":"block-in-1","id":"block-in-1-020","moves":[3,4,2,0,4,2,0,0,4,4,3,2,2,0,6,1,2,6,3,2,1,0,6,5,0,6,4],"solutions":[3]},
  {"category":"block-in-1","id":"block-in-1-021","moves":[6,2,2,2,2,1,3,0,2,0,3,4,3,3,2,5,3,4],"solutions":[1]},
  {"category":"block-in-1","id":"block-in-1-022","moves":[4,4,0,0,6,1,3],"solutions":[5]},
  {"category":"block-in-1","id":"block-in-1-023","moves":[0,5,0,6,0,1,5],"solutions":[0]},
  {"category":"block-in-1","id":"block-in-1-024","moves":[6,2,6,5,2,6,1,6,1,2,3,2,0,6,2,3,2,5],"solutions":[6]},
  {"category":"block-in-1","id":"block-in-1-025","moves":[1,5,0,4,1,1,2,3],"solutions":[6]},
  {"category":"block-in-1","id":"block-in-1-026","moves":[2,0,6,6,4,5,1,5,5,6,1,3,5,0,4,2,1,1,2,4,3,5,1,6,4,5,4,2],"solutions":[6]},
  {"category":"block-in-1","id":"block-in-1-027","moves":[2,5,6,1,2,5,0,6,6,4,6,6,5,2,4,0,1],"solutions":[3]},
  {"category":"block-in-1","id":"block-in-1-028","moves":[0,5,2,4,5,3,4,5,6,5,3,6,3,1,0,3,1],"solutions":[2]},
  {"category":"block-in-1","id":"block-in-1-029","moves":[3,0,5,6,4,2,1,5,2,4,1,5,4,6],"solutions":[3]},
  {"category":"block-in-1","id":"block-in-1-030","moves":[3,3,2,3,3,3,0],"solutions":[1]},
  {"category":"block-in-1","id":"block-in-1-031","moves":[1,4,4,4,0,1,3],"solutions":[2]},
  {"category":"block-in-1","id":"block-in-1-032","moves":[5,4,2,0,0,3,0,2,4,5,1,4,6,3,5,3],"solutions":[3]},
  {"category":"block-in-1","id":"block-in-1-033","moves":[6,5,6,0,3,1,3,1,3,2,1],"solutions":[3]},
  {"category":"block-in-1","id":"block-in-1-034","moves":[3,3,5,2,5,3,1,6,1,4,0,5,6,3,6,1,5,4],"solutions":[3]},
  {"category":"block-in-1","id":"block-in-1-035","moves":[6,0,2,6,3,0,0,0,1,4,2,2,4,3,1,4,5,4,3,2,5,5,4,5],"solutions":[3]},
  {"category":"block-in-1","id":"block-in-1-036","moves":[6,0,5,1,5,2,1,6],"solutions":[3]},
  {"category":"block-in-1","id":"block-in-1-037","moves":[5,3,0,3,5,4,5],"solutions":[5]},
  {"category":"block-in-1","id":"block-in-1-038","moves":[5,2,2,5,3,6,0,5,3,4,0,0,0,2,6,5,5,5,4,6,0,2,1],"solutions":[1]},
  {"category":"avoid-the-blunder","id":"avoid-the-blunder-001","moves":[5,5,1,1,0,3,3,0,5,6,3,3,5,5,3,3,4,0],"solutions":[6]},
  {"category":"avoid-the-blunder","id":"avoid-the-blunder-002","moves":[0,5,2,5,1,2,1,3,6,0,5,2,2,1],"solutions":[1]},
  {"category":"avoid-the-blunder","id":"avoid-the-blunder-003","moves":[5,0,3,0,4,1,4,2,3,4,4,6,4,5],"solutions":[1]},
  {"category":"avoid-the-blunder","id":"avoid-the-blunder-004","moves":[4,2,4,3,0,0,6,2,5,4,6,5,1,6,4,6,0,5,0,4,4,2,1,1,2],"solutions":[5]},
  {"category":"avoid-the-blunder","id":"avoid-the-blunder-005","moves":[0,2,3,3,2,4,5,4,2,2,6,4,4,1,5,4,0,3,4,2],"solutions":[0,3]},
  {"category":"avoid-the-blunder","id":"avoid-the-blunder-006","moves":[3,2,2,0,1,3,0,6,2,1,2,2,3,6,5,1,0,0,6],"solutions":[3]},
  {"category":"avoid-the-blunder","id":"avoid-the-blunder-007","moves":[4,1,1,5,0,3,3,4,0,0,6,6,0,0,6,6],"solutions":[3]},
  {"category":"avoid-the-blunder","id":"avoid-the-blunder-008","moves":[1,1,0,0,5,2,2,5,5,0,6,3,1,1,2,2,0,3,0,6,3,6,6,1,2,2],"solutions":[5]},
  {"category":"avoid-the-blunder","id":"avoid-the-blunder-009","moves":[2,2,6,6,2,0,6,6,2,6,2,5,1,2,3,5,0,0,3,3,1,4,3,3,5,3,0],"solutions":[5]},
  {"category":"avoid-the-blunder","id":"avoid-the-blunder-010","moves":[4,2,0,4,2,0,3,5,5,2,0,0,6,3,4],"solutions":[2]},
  {"category":"avoid-the-blunder","id":"avoid-the-blunder-011","moves":[0,1,4,4,1,1,5,1,6,0,5,4,1,6,1,3,4,5],"solutions":[5]},
  {"category":"avoid-the-blunder","id":"avoid-the-blunder-012","moves":[5,3,1,4,5,6,4,6,1,4,5,1,6,5,4,5,3],"solutions":[3]},
  {"category":"avoid-the-blunder","id":"avoid-the-blunder-013","moves":[4,3,1,2,5,2,4,3,3,6,3,0,6],"solutions":[4]},
  {"category":"avoid-the-blunder","id":"avoid-the-blunder-014","moves":[1,3,2,0,6,4,5,1,1,1,4,5,5,6,0,0,0,3],"solutions":[3]},